{
  "schema_version": "pm.connector-source/v1",
  "connector_id": "github",
  "source_set": {
    "dialect": "openapi-3.0",
    "documents": [
      {
        "source_id": "github-rest-api-description",
        "official_url": "https://raw.githubusercontent.com/github/rest-api-description/0a144e030abbe358000f0d32874e197b59a8f7ed/descriptions/api.github.com/api.github.com.json",
        "repository": "https://github.com/github/rest-api-description",
        "revision": "0a144e030abbe358000f0d32874e197b59a8f7ed",
        "path": "descriptions/api.github.com/api.github.com.json",
        "captured_at": "2026-09-14T18:54:21.837Z",
        "pointer": "#/paths/~1repos~1{owner}~1{repo}~1issues/get",
        "git_blob": "ed76b1371e381b078e50c8a698b890911031aeb2",
        "upstream_byte_length": 12939686,
        "upstream_sha256": "7c3a4bfa71e850a32992882392db3cf315dcdeca46ba5a62da963dbea6a589a2",
        "byte_length": 82561,
        "sha256": "c3d848d898194a3088180e363192ae7ddd8c7810059de278dad5709c76fece6a",
        "license": {
          "spdx": "MIT",
          "path": "connectors/github/captures/LICENSE.md",
          "sha256": "3243761cbac07e6d169a5a2f4e7c25cc544da85248e735df74c3672e055cc87b",
          "copyright": "Copyright (c) 2020 GitHub",
          "notice_required": true
        }
      }
    ],
    "references_closed": true
  },
  "operations": [
    {
      "source_operation_id": "issues/list-for-repo",
      "source_refs": [
        {
          "source_id": "github-rest-api-description",
          "pointer": "#/paths/~1repos~1{owner}~1{repo}~1issues/get"
        }
      ],
      "request_variants": [
        {
          "pointer": "#/paths/~1repos~1{owner}~1{repo}~1issues/get",
          "media_type": "application/x.pm.parameters"
        }
      ],
      "response_variants": [
        {
          "pointer": "#/paths/~1repos~1{owner}~1{repo}~1issues/get/responses/200/content/application~1json",
          "status": "200",
          "media_type": "application/json"
        },
        {
          "pointer": "#/paths/~1repos~1{owner}~1{repo}~1issues/get/responses/301",
          "status": "301",
          "media_type": "application/json"
        },
        {
          "pointer": "#/paths/~1repos~1{owner}~1{repo}~1issues/get/responses/404",
          "status": "404",
          "media_type": "application/json"
        },
        {
          "pointer": "#/paths/~1repos~1{owner}~1{repo}~1issues/get/responses/422",
          "status": "422",
          "media_type": "application/json"
        }
      ]
    }
  ],
  "semantics_revision": "sha256:c08e79455d3ca0bf410d1f4dcf790240ec70c0ecc9249b784c8c8f83b05f1ff8"
}
